{
  "status": "VERIFICATION_READY",
  "summary": "Verifier source completion; deterministic validation and simulation remain authoritative.",
  "reference_files": [
    {
      "path": "reference/uadd8_ref.py",
      "purpose": "Independent oracle for unsigned 8-bit + 8-bit -> 9-bit exact sum and transaction checking helpers.",
      "content": "def uadd8_uadd8_to_u9(a: int, b: int) -> int:\n    if not (0 <= a <= 0xFF):\n        raise ValueError(f\"a out of range: {a}\")\n    if not (0 <= b <= 0xFF):\n        raise ValueError(f\"b out of range: {b}\")\n    s = a + b\n    if not (0 <= s <= 0x1FF):\n        raise AssertionError(f\"sum out of u9 range: {s}\")\n    return s\n"
    }
  ],
  "test_files": [
    {
      "path": "tests/test_rv_uadd8.py",
      "purpose": "Contract-driven cocotb tests for ready/valid u8 adder with reset, backpressure, latency, and randomized regression.",
      "categories": [
        "directed",
        "randomized",
        "reset",
        "backpressure",
        "latency"
      ],
      "regression_groups": [
        "smoke",
        "targeted",
        "full"
      ],
      "coverage_obligations": [
        "channel.in_chan.handshake_states",
        "channel.in_chan.stall_stability",
        "channel.out_chan.handshake_states",
        "channel.out_chan.stall_stability",
        "signal.rst_n.reset_behavior",
        "operation.uadd_pair.opcode",
        "operation.uadd_pair.vector_length",
        "operation.uadd_pair.operand_classes",
        "operation.uadd_pair.numeric_behavior",
        "operation.uadd_pair.predication",
        "operation.uadd_pair.fixed_opcode_add_only",
        "operation.uadd_pair.scalar_single_element_per_transaction",
        "operation.uadd_pair.no_predication_supported",
        "operation.uadd_pair.in_chan_stall",
        "operation.uadd_pair.out_chan_stall"
      ],
      "content": "import random\nimport cocotb\nfrom cocotb.clock import Clock\nfrom cocotb.triggers import RisingEdge, FallingEdge, Timer\n\nfrom multigent.verifier_tool.coverage.runtime import contract_coverage, sample_operation\nfrom reference.uadd8_ref import uadd8_uadd8_to_u9\n\nCOVERAGE_OBLIGATIONS = {\n    \"channel.in_chan.handshake_states\",\n    \"channel.in_chan.stall_stability\",\n    \"channel.out_chan.handshake_states\",\n    \"channel.out_chan.stall_stability\",\n    \"signal.rst_n.reset_behavior\",\n    \"operation.uadd_pair.opcode\",\n    \"operation.uadd_pair.vector_length\",\n    \"operation.uadd_pair.operand_classes\",\n    \"operation.uadd_pair.numeric_behavior\",\n    \"operation.uadd_pair.predication\",\n    \"operation.uadd_pair.fixed_opcode_add_only\",\n    \"operation.uadd_pair.scalar_single_element_per_transaction\",\n    \"operation.uadd_pair.no_predication_supported\",\n    \"operation.uadd_pair.in_chan_stall\",\n    \"operation.uadd_pair.out_chan_stall\",\n}\n\n\nOPERATION_SAMPLING_BINDINGS = [{'operation': 'uadd_pair', 'point': 'operation.uadd_pair.opcode', 'template': 'custom', 'observer': 'observe_const_one', 'event': 'clock', 'fields': {'v': {'signal': 'in_valid'}}}, {'operation': 'uadd_pair', 'point': 'operation.uadd_pair.vector_length', 'template': 'custom', 'observer': 'observe_const_one', 'event': 'clock', 'fields': {'v': {'signal': 'in_valid'}}}, {'operation': 'uadd_pair', 'point': 'operation.uadd_pair.operand_classes', 'template': 'integer_operand', 'event': 'transfer', 'channel': 'in_chan', 'fields': {'value': {'signal': 'in_op_a'}}, 'data_type': 'u8'}, {'operation': 'uadd_pair', 'point': 'operation.uadd_pair.numeric_behavior', 'template': 'custom', 'observer': 'observe_sum_class', 'event': 'transfer', 'channel': 'in_chan', 'fields': {'a': {'signal': 'in_op_a'}, 'b': {'signal': 'in_op_b'}}}, {'operation': 'uadd_pair', 'point': 'operation.uadd_pair.predication', 'template': 'custom', 'observer': 'observe_const_one', 'event': 'clock', 'fields': {'v': {'signal': 'in_valid'}}}, {'operation': 'uadd_pair', 'point': 'operation.uadd_pair.fixed_opcode_add_only', 'template': 'custom', 'observer': 'observe_const_one', 'event': 'clock', 'fields': {'v': {'signal': 'in_valid'}}}, {'operation': 'uadd_pair', 'point': 'operation.uadd_pair.scalar_single_element_per_transaction', 'template': 'custom', 'observer': 'observe_const_one', 'event': 'clock', 'fields': {'v': {'signal': 'in_valid'}}}, {'operation': 'uadd_pair', 'point': 'operation.uadd_pair.no_predication_supported', 'template': 'custom', 'observer': 'observe_const_one', 'event': 'clock', 'fields': {'v': {'signal': 'in_valid'}}}, {'operation': 'uadd_pair', 'point': 'operation.uadd_pair.in_chan_stall', 'template': 'channel_stall', 'event': 'transfer', 'channel': 'in_chan'}, {'operation': 'uadd_pair', 'point': 'operation.uadd_pair.out_chan_stall', 'template': 'channel_stall', 'event': 'transfer', 'channel': 'out_chan'}]\n\ndef observe_const_one(values, state):\n    return 1\n\ndef observe_sum_class(values, state):\n    return int(values[\"a\"]) + int(values[\"b\"])\n\n# === LLM-GENERATED OPERATION ASSERTIONS ===\n\nasync def do_reset(dut):\n    dut.in_valid.value = 0\n    dut.out_ready.value = 0\n    dut.in_op_a.value = 0\n    dut.in_op_b.value = 0\n    dut.rst_n.value = 0\n    await RisingEdge(dut.clk)\n    # LLM-GENERATED OPERATION ASSERTION [reset_state]\n    assert int(dut.out_valid.value) == 0, f\"reset expected out_valid=0 got {int(dut.out_valid.value)} from dut.out_valid\"\n    dut.rst_n.value = 1\n    await RisingEdge(dut.clk)\n\n@cocotb.test(timeout_time=200000, timeout_unit=\"ns\")\n@contract_coverage()\nasync def test_rv_uadd8(dut):\n    cocotb.start_soon(Clock(dut.clk, 10, unit=\"ns\").start())\n    rng = random.Random(424242)\n    await do_reset(dut)\n\n    accepted = []\n\n    async def send_one(a, b, hold_ready_low_cycles=0):\n        while True:\n            await FallingEdge(dut.clk)\n            dut.in_valid.value = 1\n            dut.in_op_a.value = a\n            dut.in_op_b.value = b\n            await Timer(1, unit=\"ns\")\n            ir = int(dut.in_ready.value)\n            await RisingEdge(dut.clk)\n            if int(dut.rst_n.value) == 1 and ir == 1:\n                dut.in_valid.value = 0\n                return\n\n    async def recv_one(stall_cycles=0):\n        dut.out_ready.value = 0 if stall_cycles > 0 else 1\n        stalled = stall_cycles\n        while True:\n            await FallingEdge(dut.clk)\n            if stalled == 0:\n                dut.out_ready.value = 1\n            await Timer(1, unit=\"ns\")\n            ov = int(dut.out_valid.value)\n            ory = int(dut.out_ready.value)\n            val = int(dut.out_sum.value)\n            await RisingEdge(dut.clk)\n            if int(dut.rst_n.value) == 1 and ov and ory:\n                return val\n            if stalled > 0:\n                stalled -= 1\n\n    vectors = [((0, 0), \"boundary_00\"), ((255, 0), \"boundary_ff00\"), ((255, 255), \"boundary_ffff\")]\n    for (a, b), label in vectors:\n        exp = uadd8_uadd8_to_u9(a, b)\n        await send_one(a, b)\n        got = await recv_one(0)\n        # LLM-GENERATED OPERATION ASSERTION [oracle_match]\n        assert got == exp, f\"oracle mismatch a={a} b={b} expected={exp} observed={got} dut.out_sum\"\n        if label == \"boundary_00\":\n            # STIMULUS [boundary_00] targets=('operation.uadd_pair.operand_classes', 'operation.uadd_pair.numeric_behavior', 'channel.in_chan.handshake_states', 'channel.out_chan.handshake_states')\n            stimulus_id = _contract_record_checked_stimulus(\"directed\", {\"a\": a, \"b\": b}, {\"accepted_inputs\": [[a, b]], \"outputs\": [exp]}, {\"accepted_inputs\": [[a, b]], \"outputs\": [got]}, operations=(\"uadd_pair\",), label=\"boundary_00\")\n        elif label == \"boundary_ff00\":\n            # STIMULUS [boundary_ff00] targets=('operation.uadd_pair.operand_classes', 'operation.uadd_pair.numeric_behavior')\n            stimulus_id = _contract_record_checked_stimulus(\"directed\", {\"a\": a, \"b\": b}, {\"accepted_inputs\": [[a, b]], \"outputs\": [exp]}, {\"accepted_inputs\": [[a, b]], \"outputs\": [got]}, operations=(\"uadd_pair\",), label=\"boundary_ff00\")\n        else:\n            # STIMULUS [boundary_ffff] targets=('operation.uadd_pair.numeric_behavior', 'operation.uadd_pair.operand_classes')\n            stimulus_id = _contract_record_checked_stimulus(\"directed\", {\"a\": a, \"b\": b}, {\"accepted_inputs\": [[a, b]], \"outputs\": [exp]}, {\"accepted_inputs\": [[a, b]], \"outputs\": [got]}, operations=(\"uadd_pair\",), label=\"boundary_ffff\")\n        sample_operation(\"uadd_pair\", {}, \"directed\", stimulus_id)\n\n    for stall, label in [(1, \"one_cycle_stall\"), (3, \"short_stall\"), (6, \"long_stall\")]:\n        a = rng.randrange(256)\n        b = rng.randrange(256)\n        exp = uadd8_uadd8_to_u9(a, b)\n        await send_one(a, b)\n        got = await recv_one(stall)\n        # LLM-GENERATED OPERATION ASSERTION [stall_oracle_match]\n        assert got == exp, f\"stall mismatch a={a} b={b} expected={exp} observed={got} dut.out_sum stall={stall}\"\n        if label == \"one_cycle_stall\":\n            # STIMULUS [one_cycle_stall] targets=('channel.in_chan.stall_stability', 'channel.out_chan.stall_stability', 'operation.uadd_pair.in_chan_stall', 'operation.uadd_pair.out_chan_stall')\n            stimulus_id = _contract_record_checked_stimulus(\"directed\", {\"a\": a, \"b\": b, \"stall\": stall}, {\"accepted_inputs\": [[a, b]], \"outputs\": [exp]}, {\"accepted_inputs\": [[a, b]], \"outputs\": [got]}, operations=(\"uadd_pair\",), label=\"one_cycle_stall\")\n        elif label == \"short_stall\":\n            # STIMULUS [short_stall] targets=('channel.in_chan.stall_stability', 'channel.out_chan.stall_stability', 'operation.uadd_pair.in_chan_stall', 'operation.uadd_pair.out_chan_stall')\n            stimulus_id = _contract_record_checked_stimulus(\"directed\", {\"a\": a, \"b\": b, \"stall\": stall}, {\"accepted_inputs\": [[a, b]], \"outputs\": [exp]}, {\"accepted_inputs\": [[a, b]], \"outputs\": [got]}, o